{
  "$schema": "../../schemas/libAction.schema.json",
  "name": "Delete from local storage",
  "description": "Delete a value from local storage (if found) based on the provided key.",
  "group": "local_storage",
  "arguments": [
    {
      "name": "Key",
      "description": "The key in local storage to delete.",
      "type": { "type": "String" },
      "formula": {
        "type": "value",
        "value": ""
      }
    }
  ]
}
