{
  "$schema": "../../schemas/libAction.schema.json",
  "name": "Copy to clipboard",
  "description": "Copy contents to the clipboard.",
  "group": "sharing",
  "arguments": [
    {
      "name": "Value",
      "description": "The value you want to copy.",
      "type": { "type": "String" },
      "formula": {
        "type": "value",
        "value": "<Param Value>"
      }
    }
  ]
}
