{
  "$schema": "../../schemas/libAction.schema.json",
  "name": "Log to console",
  "description": "Log a message to the browser console.",
  "group": "debugging",
  "arguments": [
    {
      "name": "Label",
      "description": "A label for the message.",
      "formula": {
        "type": "value",
        "value": ""
      }
    },
    {
      "name": "Data",
      "type": { "type": "Any" },
      "description": "The data you want to log to the console.",
      "formula": {
        "type": "value",
        "value": "<Data>"
      }
    }
  ]
}
